{
  "$schema": "../../../schemas/openrazer-native-route-catalog.schema.json",
  "schema": "hyperflux-openrazer-native-route-catalog-v1",
  "upstream_commit": "6820f9da169d354bc7e6e93a0aa8683a6bb75792",
  "metadata_sha256": "36a26c62f1992a9f84f7925c9f9a4252e449f966efb61ab6511d08fb2569eee2",
  "transport": {
    "protocol_family": "razer-feature-report-v1",
    "report_bytes": 90,
    "phys_prefix": "hyperflux-next/native/v1/",
    "descriptor_hex": "0600ff0901a101150026ff007508955ab102c0",
    "descriptor_sha256": "c7e08a941d29843614b92bac12957f77d764a3f7a765161bfb2ba2434a76ae74"
  },
  "routes": [
    {
      "profile_id": "child.razer.basilisk-v3-pro-35k.00cd",
      "vendor_id": 5426,
      "wireless_product_id": 205,
      "model_name": "Razer Basilisk V3 Pro 35K (Wireless)",
      "device_kind": "mouse",
      "driver_family": "razermouse",
      "source": {
        "path": "daemon/openrazer_daemon/hardware/mouse.py",
        "class_name": "RazerBasiliskV3Pro35KWireless",
        "sha256": "c36180167f3f07f2299eb2653dd171ce6086a5cb0c30a898d9ee2be3dc3c4c03"
      },
      "direct_data_product_ids": [204],
      "event_file_regex": ".*Razer_Basilisk_V3_Pro_35K_000000000000-if0(1|2)-event-kbd"
    },
    {
      "profile_id": "child.razer.deathstalker-v2-pro-tkl.0296",
      "vendor_id": 5426,
      "wireless_product_id": 662,
      "model_name": "Razer DeathStalker V2 Pro TKL (Wireless)",
      "device_kind": "keyboard",
      "driver_family": "razerkbd",
      "source": {
        "path": "daemon/openrazer_daemon/hardware/keyboards.py",
        "class_name": "RazerDeathStalkerV2ProTKLWireless",
        "sha256": "a4d6b54f4e6da3a7ff65a727ccc5b047efb345d3170d0a2f8256b5f0a7c1d5e9"
      },
      "direct_data_product_ids": [664],
      "event_file_regex": ".*DSV2Pro_TKL_000000000000-if01-event-mouse"
    }
  ]
}
